{
  "_meta": {
    "established_at": "2026-05-04",
    "established_in_memo": "2026-05 - Investment Memo - Microsoft (MSFT).docx",
    "approved_by": "Luis del Cid (CIO)",
    "ips_reference": "IPS §4.7",
    "last_modified": "2026-05-04",
    "modification_history": []
  },
  "ticker": "MSFT",
  "company": "Microsoft Corporation",
  "classification": "Core Compounder",
  "tesis_resumen": "Microsoft compone capital sosteniblemente vía (1) Azure capturando share secular en cloud enterprise, (2) Office/Productivity con pricing power y monetización de Copilot, (3) ROIC marginal sobre capex de IA superior al WACC. Posición Core con horizonte 10+ años.",
  "tier_1_metrics": [
    {
      "id": "ROIC_MARGINAL",
      "name": "ROIC marginal",
      "description": "Retorno sobre capital incremental invertido en los últimos 12 meses. Métrica universal IPS §4.7.",
      "direction": "higher_is_better",
      "unit": "%",
      "expected_range": [15, 25],
      "yellow_threshold": 12,
      "red_threshold": 9,
      "data_source": "10-K + cálculo interno (delta NOPAT / delta invested capital)",
      "frequency": "quarterly",
      "thesis_link": "Capex de IA debe generar ROIC marginal > WACC (~9%). Si cae bajo 9% sostenidamente, el ciclo de inversión destruye valor y la tesis Core se rompe.",
      "current_value": null,
      "current_status": null,
      "last_updated": null
    },
    {
      "id": "AZURE_GROWTH_CC",
      "name": "Azure growth (constant currency)",
      "description": "Crecimiento YoY de Azure en moneda constante. Validador de la tesis cloud share gain.",
      "direction": "higher_is_better",
      "unit": "%",
      "expected_range": [25, 35],
      "yellow_threshold": 22,
      "red_threshold": 18,
      "data_source": "MSFT Earnings Release (Intelligent Cloud segment)",
      "frequency": "quarterly",
      "thesis_link": "Azure debe crecer >22% para sostener la narrativa de share gain vs AWS/GCP. Caer a 18% indica saturación o pérdida competitiva.",
      "current_value": null,
      "current_status": null,
      "last_updated": null
    },
    {
      "id": "OPERATING_MARGIN",
      "name": "Operating margin consolidado",
      "description": "Margen operativo trailing 4 trimestres.",
      "direction": "higher_is_better",
      "unit": "%",
      "expected_range": [42, 47],
      "yellow_threshold": 40,
      "red_threshold": 37,
      "data_source": "10-Q / 10-K",
      "frequency": "quarterly",
      "thesis_link": "El margen operativo refleja la economía agregada del business mix. Cae bajo 40% indica presión por capex/opex de IA sin retorno proporcional.",
      "current_value": null,
      "current_status": null,
      "last_updated": null
    },
    {
      "id": "M365_COMMERCIAL_GROWTH",
      "name": "M365 Commercial revenue growth",
      "description": "Crecimiento YoY de Microsoft 365 Commercial. Mide tracción de Copilot y pricing power en Productivity.",
      "direction": "higher_is_better",
      "unit": "%",
      "expected_range": [12, 18],
      "yellow_threshold": 10,
      "red_threshold": 7,
      "data_source": "MSFT Earnings Release (Productivity & Business Processes segment)",
      "frequency": "quarterly",
      "thesis_link": "Validador de la tesis de monetización de Copilot. Bajo 7% YoY indica pricing power debilitado o adopción Copilot decepcionante.",
      "current_value": null,
      "current_status": null,
      "last_updated": null
    },
    {
      "id": "FCF_CONVERSION",
      "name": "FCF conversion (FCF / Net Income)",
      "description": "Razón de conversión de utilidad neta a flujo libre. Salud de calidad de utilidades.",
      "direction": "higher_is_better",
      "unit": "ratio",
      "expected_range": [0.95, 1.15],
      "yellow_threshold": 0.85,
      "red_threshold": 0.75,
      "data_source": "10-K cash flow statement",
      "frequency": "quarterly",
      "thesis_link": "Capex de IA puede temporalmente comprimir FCF conversion. Bajo 0.75 sostenido indica que el capex no genera retorno y deteriora la calidad de utilidades.",
      "current_value": null,
      "current_status": null,
      "last_updated": null
    }
  ]
}
